{
  "name": "Sites Social Follow",
  "description": "This block represents a clickable \"follow\" link to be rendered on the page",
  "id": "669768ce-44c7-4de3-83c1-a72d871e8df2",
  "classification": "content-type",
  "elements": [
    {
      "elementType": "text",
      "key": "iconSet",
      "label": "Icon Set"
    },
    {
      "allowMultipleValues": true,
      "elementType": "group",
      "key": "socialLinks",
      "helpText": "This element controls the link icon and click target for this block.",
      "label": "Social Links",
      "required": false,
      "typeRef": {
        "name": "Sites Social Link",
        "id": "98f24456-bf11-4248-bca9-07e273b8dbc4"
      }
    },
    {
      "elementType": "number",
      "fieldType": "integer",
      "helpText": "This element controls the size of this block.",
      "key": "size",
      "label": "Size"
    },
    {
      "elementType": "group",
      "key": "backgroundColor",
      "helpText": "This element controls the background for this block.",
      "label": "Background Color",
      "typeRef": {
        "name": "Sites Color",
        "id": "93ed78a8-cea7-4188-8584-a8bedca6ebac"
      }
    },
    {
      "elementType": "group",
      "key": "alignment",
      "helpText": "This element controls the alignment definition for this block.",
      "label": "Alignment",
      "typeRef": {
        "name": "Sites Alignment",
        "id": "d0cf6fd8-e061-4bd6-8f62-fd3ea795b4e5"
      }
    },
    {
      "elementType": "number",
      "fieldType": "integer",
      "helpText": "This element controls the spacing to be added between clickable icons.",
      "key": "spacing",
      "label": "Spacing between iconsâ€‹"
    },
    {
      "elementType": "group",
      "key": "padding",
      "helpText": "This element controls the padding values for this block.",
      "label": "Padding",
      "typeRef": {
        "name": "Sites Boundary",
        "id": "d403f72d-5383-423c-ba33-5cedd61c9224"
      }
    },
    {
      "elementType": "group",
      "key": "commonSettings",
      "helpText": "This element controls the common settings for this block.",
      "label": "Common Settings",
      "typeRef": {
        "name": "Sites Common Settings",
        "id": "dba345e3-10a0-44ed-b0aa-6cffe74e1343"
      }
    },
    {
      "elementType": "text",
      "helpText": "This element is used to uniquely identify this element in the current content item",
      "key": "key",
      "label": "Key"
    }
  ],
  "kind": ["standalone", "embedded"],
  "status": "ready",
  "tags": ["sites-next"],
  "rev": "0-a0e5b4b0-cec1-4a17-b631-9b2280e4a823"
}
