{
  "name": "Sites Link Bar",
  "description": "This block represents a list of links to be rendered on a page",
  "id": "d0f831c3-1b0a-41ba-8a6b-10f2eca3789a",
  "classification": "content-type",
  "elements": [
    {
      "allowMultipleValues": true,
      "elementType": "link",
      "helpText": "This element controls the actual list of links for this link bar.",
      "fieldLabel": "Links",
      "key": "links",
      "label": "Links",
      "maximumValues": 7,
      "minimumValues": 2,
      "required": true
    },
    {
      "elementType": "group",
      "key": "textStyle",
      "helpText": "This element controls the text styling for this link bar.",
      "label": "Text Style",
      "typeRef": {
        "name": "Sites Styling",
        "id": "cfa7081a-921d-4f50-a543-027b983b01b5"
      }
    },
    {
      "elementType": "group",
      "key": "backgroundColor",
      "helpText": "This element controls the background color for this link bar.",
      "label": "Background Color",
      "typeRef": {
        "name": "Sites Color",
        "id": "93ed78a8-cea7-4188-8584-a8bedca6ebac"
      }
    },
    {
      "elementType": "group",
      "key": "alignment",
      "helpText": "This element controls the alignment defintion for this link bar.",
      "label": "Alignment",
      "typeRef": {
        "name": "Sites Alignment",
        "id": "d0cf6fd8-e061-4bd6-8f62-fd3ea795b4e5"
      }
    },
    {
      "elementType": "number",
      "fieldType": "integer",
      "helpText": "This element controls the spacing between links.",
      "key": "spacingBetweenLinks",
      "label": "Spacing between links"
    },
    {
      "elementType": "group",
      "key": "padding",
      "helpText": "This element controls the padding values for this link bar.",
      "label": "Padding",
      "typeRef": {
        "name": "Sites Boundary",
        "id": "d403f72d-5383-423c-ba33-5cedd61c9224"
      }
    },
    {
      "elementType": "group",
      "key": "verticalRule",
      "label": "Vertical Rule",
      "helpText": "This element controls the vertical rules to be used by this link bar.",
      "typeRef": {
        "name": "Sites Vertical Rule",
        "id": "8e460c39-9cf6-4a78-9726-ee43ad961a8a"
      }
    },
    {
      "elementType": "group",
      "key": "commonSettings",
      "helpText": "This element controls the common settings for this link bar.",
      "label": "Common Settings",
      "typeRef": {
        "name": "Sites Common Settings",
        "id": "dba345e3-10a0-44ed-b0aa-6cffe74e1343"
      }
    },
    {
      "elementType": "text",
      "helpText": "This element is used to uniquely identify this element in the current content item",
      "key": "key",
      "label": "Key"
    }
  ],
  "kind": ["standalone", "embedded"],
  "status": "ready",
  "tags": ["sites-next"],
  "rev": "0-8c8462e2-d19d-4a6d-b5b7-f7d1792a16d9"
}
