{
  "id": "b7b05524-87ed-4509-b6fb-972f2cbf26d5",
  "rev": "1-ced7651cf7e3a5ea563c60c4570907bb",
  "name": "Image",
  "classification": "content-type",
  "kind": [
    "standalone",
    "embedded"
  ],
  "contentThumbnail": {
    "imageElement": "image",
    "source": "imageElementOrType"
  },
  "description": "",
  "status": "ready",
  "tags": [
    "IBM email sample"
  ],
  "elements": [
    {
      "elementType": "image",
      "label": "Image",
      "key": "image",
      "acceptType": [
        "jpg",
        "jpeg",
        "png",
        "gif"
      ]
    },
    {
      "elementType": "group",
      "typeRef": {
        "id": "0915841f-cf93-4e3c-8ece-f22b0c41a9e6"
      },
      "label": "Alignment",
      "key": "align"
    },
    {
      "elementType": "group",
      "typeRef": {
        "id": "9c5e08f5-e54d-42c4-b855-c73eb0908022"
      },
      "label": "Padding",
      "key": "padding"
    },
    {
      "elementType": "group",
      "typeRef": {
        "id": "9c5e08f5-e54d-42c4-b855-c73eb0908022"
      },
      "label": "Margin",
      "key": "margin"
    },
    {
      "elementType": "group",
      "typeRef": {
        "id": "eeff476e-0559-444f-97d1-486a10a86b80"
      },
      "label": "Common Settings",
      "key": "commonSettings"
    }
  ]
}