{
  "id": "0c6b2078-02dd-4c5d-858f-99d6d88114b5",
  "rev": "3-531e65b8fe4f982c6e6a9bd7ecdc2a44",
  "name": "Background Image",
  "classification": "content-type",
  "kind": [
    "embedded"
  ],
  "contentThumbnail": {
    "imageElement": "image",
    "source": "imageElementOrType"
  },
  "description": "",
  "status": "ready",
  "tags": [],
  "elements": [
    {
      "elementType": "toggle",
      "label": "Include background image",
      "key": "includeBackgroundImage"
    },
    {
      "elementType": "image",
      "label": "Image",
      "key": "image",
      "acceptType": [
        "jpg",
        "jpeg",
        "png",
        "gif"
      ]
    },
    {
      "elementType": "optionselection",
      "options": [
        {
          "label": "Full Width",
          "selection": "full-width"
        },
        {
          "label": "Center",
          "selection": "center"
        },
        {
          "label": "Tile",
          "selection": "tile"
        }
      ],
      "label": "Fill options",
      "key": "fillOptions"
    },
    {
      "elementType": "text",
      "label": "Key",
      "key": "key"
    }
  ]
}