{
  "name": "Sites Promotion",
  "description": "This block represents a promotion item to be rendered on a page. A promotion is comprised by an image, a text, and a clickable button.",
  "id": "0b1c47a9-eb31-49ec-8fd7-89ca21a36b36",
  "classification": "content-type",
  "elements": [
    {
      "elementType": "group",
      "key": "background",
      "helpText": "This element controls the background for this promotion block.",
      "label": "Background",
      "typeRef": {
        "name": "Sites Background",
        "id": "0a92059b-de6b-476d-b291-1638a435d0af"
      }
    },
    {
      "elementType": "group",
      "key": "margin",
      "helpText": "This element controls the margin values for this promotion block.",
      "label": "Margin",
      "typeRef": {
        "name": "Sites Boundary",
        "id": "d403f72d-5383-423c-ba33-5cedd61c9224"
      }
    },
    {
      "elementType": "group",
      "key": "text",
      "helpText": "This element holds the actual text data for this promotion block.",
      "label": "Text",
      "typeRef": {
        "name": "Sites Text",
        "id": "373c81a5-d86b-4740-8f11-62fcbccfca08"
      }
    },
    {
      "elementType": "group",
      "key": "image",
      "helpText": "This element holds the image for this promotion block.",
      "label": "Image",
      "typeRef": {
        "name": "Sites Image",
        "id": "c8295d37-7235-495e-8d40-f3b8bafe4099"
      }
    },
    {
      "elementType": "group",
      "key": "button",
      "helpText": "This element controls the button for this promotion block.",
      "label": "Button",
      "typeRef": {
        "name": "Sites Button",
        "id": "dee92057-69e3-489b-b13b-15f9b28770a1"
      }
    },
    {
      "elementType": "group",
      "key": "commonSettings",
      "helpText": "This element controls the common settings for this block.",
      "label": "Common Settings",
      "typeRef": {
        "name": "Sites Common Settings",
        "id": "dba345e3-10a0-44ed-b0aa-6cffe74e1343"
      }
    },
    {
      "elementType": "optionselection",
      "key": "layout",
      "helpText": "This element controls the layout to be applied to this promotion block.",
      "label": "Layout",
      "options": [
        {
          "label": "Image Left",
          "selection": "image-left"
        },
        {
          "label": "Image Right",
          "selection": "image-right"
        },
        {
          "label": "Image Top",
          "selection": "image-top"
        }
      ]
    },
    {
      "elementType": "text",
      "helpText": "This element is used to uniquely identify this element in the current content item",
      "key": "key",
      "label": "Key"
    }
  ],
  "kind": ["standalone", "embedded"],
  "status": "ready",
  "tags": ["sites-next"],
  "rev": "0-b7cf0430-1ee6-4c32-ac0f-8308c3f85970"
}
