{
  "id": "d5f01209-aa97-4118-81e2-fa26932e63af",
  "rev": "1-8dbc3d43303388638c32d7848d14f589",
  "name": "Social icon",
  "classification": "content-type",
  "kind": [
    "embedded"
  ],
  "contentThumbnail": {
    "imageElement": "icon",
    "source": "imageElementOrType"
  },
  "description": "",
  "status": "ready",
  "tags": [],
  "elements": [
    {
      "elementType": "image",
      "label": "Icon",
      "key": "icon"
    },
    {
      "elementType": "number",
      "fieldType": "integer",
      "label": "Size",
      "key": "size"
    },
    {
      "elementType": "link",
      "label": "LinkURL",
      "key": "linkurl"
    }
  ]
}