{
  "name": "Sites Image",
  "description": "",
  "id": "c8295d37-7235-495e-8d40-f3b8bafe4099",
  "classification": "content-type",
  "contentThumbnail": {
    "imageElement": "image",
    "source": "imageElementOrType"
  },
  "elements": [
    {
      "acceptType": [
        "jpg",
        "jpeg",
        "png",
        "gif"
      ],
      "elementType": "image",
      "key": "image",
      "label": "Image"
    },
    {
      "elementType": "group",
      "key": "alignment",
      "label": "Alignment",
      "typeRef": {
        "name": "Sites Alignment",
        "id": "d0cf6fd8-e061-4bd6-8f62-fd3ea795b4e5"
      }
    },
    {
      "elementType": "group",
      "key": "padding",
      "label": "Padding",
      "typeRef": {
        "name": "Sites Boundary",
        "id": "d403f72d-5383-423c-ba33-5cedd61c9224"
      }
    },
    {
      "elementType": "group",
      "key": "margin",
      "label": "Margin",
      "typeRef": {
        "name": "Sites Boundary",
        "id": "d403f72d-5383-423c-ba33-5cedd61c9224"
      }
    },
    {
      "elementType": "group",
      "key": "commonSettings",
      "label": "Common Settings",
      "typeRef": {
        "name": "Sites Common Settings",
        "id": "dba345e3-10a0-44ed-b0aa-6cffe74e1343"
      }
    },
    {
      "elementType": "text",
      "key": "key",
      "label": "Key"
    }
  ],
  "kind": [
    "standalone",
    "embedded"
  ],
  "status": "ready",
  "tags": [
    "sites-next"
  ],
  "rev": "0-994eafcc-4c98-4ae0-9a9a-61fd7462060e"
}