{
  "name": "Sites Navigation Component",
  "description": "",
  "id": "6854f419-3b8b-4410-8d33-134a485d05a3",
  "classification": "content-type",
  "elements": [
    {
      "elementType": "number",
      "fieldType": "integer",
      "key": "startingWithNavigationLevel",
      "label": "Starting with Navigation Level",
      "required": true
    },
    {
      "elementType": "number",
      "fieldType": "integer",
      "key": "numberOfNavigationLevels",
      "label": "Number of Navigation Levels",
      "required": true
    }
  ],
  "kind": [
    "embedded"
  ],
  "status": "ready",
  "tags": [],
  "rev": "0-054617e6-77c8-46cc-9470-d2503884beb7"
}