{
  "name": "Sites Text",
  "description": "",
  "id": "373c81a5-d86b-4740-8f11-62fcbccfca08",
  "classification": "content-type",
  "elements": [
    {
      "elementType": "formattedtext",
      "key": "text",
      "label": "text",
      "placeholder": {
        "show": true,
        "text": "Text"
      }
    },
    {
      "elementType": "group",
      "key": "textStyle",
      "label": "Text Style",
      "typeRef": {
        "name": "Sites Styling",
        "id": "cfa7081a-921d-4f50-a543-027b983b01b5"
      }
    },
    {
      "elementType": "group",
      "key": "linkColor",
      "label": "Link Color",
      "typeRef": {
        "name": "Sites Color",
        "id": "93ed78a8-cea7-4188-8584-a8bedca6ebac"
      }
    },
    {
      "elementType": "group",
      "key": "background",
      "label": "Background",
      "typeRef": {
        "name": "Sites Background",
        "id": "0a92059b-de6b-476d-b291-1638a435d0af"
      }
    },
    {
      "elementType": "group",
      "key": "alignment",
      "label": "Alignment",
      "typeRef": {
        "name": "Sites Alignment",
        "id": "d0cf6fd8-e061-4bd6-8f62-fd3ea795b4e5"
      }
    },
    {
      "elementType": "group",
      "key": "lineHeight",
      "label": "Line Height",
      "typeRef": {
        "name": "Sites Line Height",
        "id": "e5e97340-b03b-42ea-9d03-f8bc214f42b0"
      }
    },
    {
      "elementType": "group",
      "key": "padding",
      "label": "Padding",
      "typeRef": {
        "name": "Sites Boundary",
        "id": "d403f72d-5383-423c-ba33-5cedd61c9224"
      }
    },
    {
      "elementType": "group",
      "key": "margin",
      "label": "Margin",
      "typeRef": {
        "name": "Sites Boundary",
        "id": "d403f72d-5383-423c-ba33-5cedd61c9224"
      }
    },
    {
      "elementType": "group",
      "key": "commonSettings",
      "label": "Common Settings",
      "typeRef": {
        "name": "Sites Common Settings",
        "id": "dba345e3-10a0-44ed-b0aa-6cffe74e1343"
      }
    },
    {
      "elementType": "text",
      "key": "key",
      "label": "Key"
    }
  ],
  "kind": [
    "standalone",
    "embedded"
  ],
  "status": "ready",
  "tags": [
    "sites-next"
  ],
  "rev": "0-2462bdc9-04e6-43fe-a213-2fee3c4fe665"
}