{
  "name": "Sites Color",
  "description": "",
  "id": "93ed78a8-cea7-4188-8584-a8bedca6ebac",
  "classification": "content-type",
  "elements": [
    {
      "elementType": "text",
      "key": "colorCode",
      "label": "Color code"
    },
    {
      "elementType": "text",
      "key": "key",
      "label": "Key"
    }
  ],
  "kind": [
    "embedded"
  ],
  "status": "ready",
  "tags": [
    "sites-next"
  ],
  "rev": "0-04f2bec4-3937-4364-9425-a33ff3de8cc6"
}